Poster_Link,Series_Title,Genre,Director,text-prep-stem
"https://m.media-amazon.com/images/M/MV5BMjIxNDYxMTk2MF5BMl5BanBnXkFtZTgwMjQxNjU3MTE@._V1_UY98_CR0,0,67,98_AL_.jpg",The Outlaw Josey Wales,Western,Clint Eastwood,western missouri farmer josey wale join confeder guerrilla unit wind run union soldier murder famili clint eastwood clint eastwood sondra lock chief dan georg bill mckinney
"https://m.media-amazon.com/images/M/MV5BZWQzYjBjZmQtZDFiOS00ZDQ1LWI4MDAtMDk1NGE1NDBhYjNhL2ltYWdlXkEyXkFqcGdeQXVyNjc1NTYyMjg@._V1_UX67_CR0,0,67,98_AL_.jpg",The Man Who Would Be King,"Adventure, History, War",John Huston,adventur histori war two british former soldier decid set king kafiristan land white man set foot sinc alexand great john huston sean conneri michael cain christoph plummer saeed jaffrey
"https://m.media-amazon.com/images/M/MV5BNzZlMThlYzktMDlmZC00YTI1LThlNzktZWU0MTY4ODc2ZWY4XkEyXkFqcGdeQXVyNTA1NjYyMDk@._V1_UX67_CR0,0,67,98_AL_.jpg",The Conversation,"Drama, Mystery, Thriller",Francis Ford Coppola,drama mysteri thriller paranoid secret surveil expert crisi conscienc suspect coupl spi murder franci ford coppola gene hackman john cazal allen garfield freder forrest
"https://m.media-amazon.com/images/M/MV5BYjhhMDFlZDctYzg1Mi00ZmZiLTgyNTgtM2NkMjRkNzYwZmQ0XkEyXkFqcGdeQXVyMTMxODk2OTU@._V1_UX67_CR0,0,67,98_AL_.jpg",La planète sauvage,"Animation, Sci-Fi",René Laloux,anim scifi faraway planet blue giant rule oppress humanoid rebel machinelik leader rené laloux barri bostwick jennif drake eric baugin jean topart
"https://m.media-amazon.com/images/M/MV5BNjZmMWE4NzgtZjc5OS00NTBmLThlY2MtM2MzNTA5NTZiNTFjXkEyXkFqcGdeQXVyNjc1NTYyMjg@._V1_UY98_CR0,0,67,98_AL_.jpg",The Day of the Jackal,"Crime, Drama, Thriller",Fred Zinnemann,crime drama thriller profession assassin codenam jackal plot kill charl de gaull presid franc fred zinnemann edward fox terenc alexand michel auclair alan badel
"https://m.media-amazon.com/images/M/MV5BMDcxNjhiOTEtMzQ0YS00OTBhLTkxM2QtN2UyZDMzNzIzNWFlXkEyXkFqcGdeQXVyMTQxNzMzNDI@._V1_UY98_CR1,0,67,98_AL_.jpg",Badlands,"Action, Crime, Drama",Terrence Malick,action crime drama impression teenag girl deadend town older greaser boyfriend embark kill spree south dakota badland terrenc malick martin sheen sissi spacek warren oat ramon bieri
"https://m.media-amazon.com/images/M/MV5BNTEyMzc0Mjk5MV5BMl5BanBnXkFtZTgwMjI2NDIwMTE@._V1_UX67_CR0,0,67,98_AL_.jpg",Cabaret,"Drama, Music, Musical",Bob Fosse,drama music music femal girli club entertain weimar republ era berlin romanc two men nazi parti rise power around bob foss liza minnelli michael york helmut griem joel grey
"https://m.media-amazon.com/images/M/MV5BZTllNDU0ZTItYTYxMC00OTI4LThlNDAtZjNiNzdhMWZiYjNmXkEyXkFqcGdeQXVyNzY1NDgwNjQ@._V1_UX67_CR0,0,67,98_AL_.jpg",Willy Wonka & the Chocolate Factory,"Family, Fantasy, Musical",Mel Stuart,famili fantasi music poor hope boy seek one five covet golden ticket send tour willi wonka mysteri chocol factori mel stuart gene wilder jack albertson peter ostrum roy kinnear
"https://m.media-amazon.com/images/M/MV5BNTgwZmIzMmYtZjE3Yy00NzgzLTgxNmUtNjlmZDlkMzlhOTJkXkEyXkFqcGdeQXVyNjUwNzk3NDc@._V1_UX67_CR0,0,67,98_AL_.jpg",Midnight Cowboy,Drama,John Schlesinger,drama naiv hustler travel texa new york citi seek person fortun find new friend process john schlesing dustin hoffman jon voight sylvia mile john mcgiver
"https://m.media-amazon.com/images/M/MV5BMTQyNTAzOTI3NF5BMl5BanBnXkFtZTcwNTM0Mjg0Mg@@._V1_UX67_CR0,0,67,98_AL_.jpg",Wait Until Dark,Thriller,Terence Young,thriller recent blind woman terror trio thug search heroinstuf doll believ apart terenc young audrey hepburn alan arkin richard crenna efrem zimbalist jr
"https://m.media-amazon.com/images/M/MV5BZTVmMTk2NjUtNjVjNC00OTcwLWE4OWEtNzA4Mjk1ZmIwNDExXkEyXkFqcGdeQXVyNjUwNzk3NDc@._V1_UX67_CR0,0,67,98_AL_.jpg",Guess Who's Coming to Dinner,"Comedy, Drama",Stanley Kramer,comedi drama coupl attitud challeng daughter introduc africanamerican fiancé stanley kramer spencer traci sidney poitier katharin hepburn katharin houghton
"https://m.media-amazon.com/images/M/MV5BOTViZmMwOGEtYzc4Yy00ZGQ1LWFkZDQtMDljNGZlMjAxMjhiXkEyXkFqcGdeQXVyNzM0MTUwNTY@._V1_UX67_CR0,0,67,98_AL_.jpg",Bonnie and Clyde,"Action, Biography, Crime",Arthur Penn,action biographi crime bore waitress bonni parker fall love excon name clyde barrow togeth start violent crime spree countri steal car rob bank arthur penn warren beatti fay dunaway michael j pollard gene hackman
"https://m.media-amazon.com/images/M/MV5BNGM0ZTU3NmItZmRmMy00YWNjLWEzMWItYzg3MzcwZmM5NjdiXkEyXkFqcGdeQXVyNDYyMDk5MTU@._V1_UY98_CR2,0,67,98_AL_.jpg",My Fair Lady,"Drama, Family, Musical",George Cukor,drama famili music snobbish phonet professor henri higgin agre wager make flower girl eliza doolittl present high societi georg cukor audrey hepburn rex harrison stanley holloway wilfrid hydewhit
"https://m.media-amazon.com/images/M/MV5BNmJkODczNjItNDI5Yy00MGI1LTkyOWItZDNmNjM4ZGI1ZDVlL2ltYWdlL2ltYWdlXkEyXkFqcGdeQXVyMDI2NDg0NQ@@._V1_UX67_CR0,0,67,98_AL_.jpg",Mary Poppins,"Comedy, Family, Fantasy",Robert Stevenson,comedi famili fantasi turn centuri london magic nanni employ music adventur help two neglect children becom closer father robert stevenson juli andrew dick van dyke david tomlinson glyni john
"https://m.media-amazon.com/images/M/MV5BZTM1ZjQ2YTktNDM2MS00NGY2LTkzNzItZTU4ODg1ODNkMWYxL2ltYWdlXkEyXkFqcGdeQXVyNjc1NTYyMjg@._V1_UX67_CR0,0,67,98_AL_.jpg",The Longest Day,"Action, Drama, History",Ken Annakin,action drama histori event dday told grand scale alli german point view ken annakin andrew marton gerd oswald bernhard wicki darryl f zanuck
"https://m.media-amazon.com/images/M/MV5BZTM1MTRiNDctMTFiMC00NGM1LTkyMWQtNTY1M2JjZDczOWQ3XkEyXkFqcGdeQXVyMDI3OTIzOA@@._V1_UY98_CR3,0,67,98_AL_.jpg",Jules et Jim,"Drama, Romance",François Truffaut,drama romanc decad love triangl concern two friend impuls woman françoi truffaut jeann moreau oskar werner henri serr vanna urbino
"https://m.media-amazon.com/images/M/MV5BNGQyNjBjNTUtNTM1OS00YzcyLWFhNTgtNTU0MDg3NzBlMDQzXkEyXkFqcGdeQXVyNjc1NTYyMjg@._V1_UY98_CR0,0,67,98_AL_.jpg",The Innocents,Horror,Jack Clayton,horror young gover two children becom convinc hous ground haunt jack clayton deborah kerr peter wyngard meg jenkin michael redgrav
"https://m.media-amazon.com/images/M/MV5BNzk5MDk2MjktY2I3NS00ODZkLTk3OTktY2Q3ZDE2MmQ2M2ZmXkEyXkFqcGdeQXVyNjc1NTYyMjg@._V1_UY98_CR2,0,67,98_AL_.jpg",À bout de souffle,"Crime, Drama",Jean-Luc Godard,crime drama smalltim thief steal car impuls murder motorcycl policeman want author reunit hip american journal student attempt persuad run away itali jeanluc godard jeanpaul belmondo jean seberg daniel boulang henrijacqu huet
"https://m.media-amazon.com/images/M/MV5BNzNiOGJhMDUtZjNjMC00YmE5LTk3NjQtNGM4ZjAzOGJjZmRlXkEyXkFqcGdeQXVyNjc1NTYyMjg@._V1_UX67_CR0,0,67,98_AL_.jpg",Red River,"Action, Adventure, Drama",Howard Hawks,action adventur drama dunson lead cattl drive culmin year work destin missouri tyrann behavior along way caus mutini led adopt son howard hawk arthur rosson john wayn montgomeri clift joann dru
"https://m.media-amazon.com/images/M/MV5BODI3YzNiZTUtYjEyZS00ODkwLWE2ZDUtNGJmMTNiYTc4ZTM4XkEyXkFqcGdeQXVyMDI2NDg0NQ@@._V1_UX67_CR0,0,67,98_AL_.jpg",Key Largo,"Action, Crime, Drama",John Huston,action crime drama man visit war buddi famili hotel find gangster run thing hurrican approach two end confront john huston humphrey bogart edward g robinson lauren bacal lionel barrymor
"https://m.media-amazon.com/images/M/MV5BZGU2YmU0MWMtMzg5My00ZmY2LTljMDItMTg2YTI5Y2U2OTE3XkEyXkFqcGdeQXVyMjUxODE0MDY@._V1_UY98_CR0,0,67,98_AL_.jpg",To Have and Have Not,"Adventure, Comedy, Film-Noir",Howard Hawks,adventur comedi filmnoir world war ii american expatri harri morgan help transport french resist leader beauti wife martiniqu romanc sensuous loung singer howard hawk humphrey bogart lauren bacal walter brennan dolor moran
"https://m.media-amazon.com/images/M/MV5BM2I1YWM4NTYtYjA0Ny00ZDEwLTg3NTgtNzBjMzZhZTk1YTA1XkEyXkFqcGdeQXVyMTY5Nzc4MDY@._V1_UX67_CR0,0,67,98_AL_.jpg",Shadow of a Doubt,"Film-Noir, Thriller",Alfred Hitchcock,filmnoir thriller young girl overjoy favorit uncl come visit famili slowli begin suspect fact merri widow killer sought author alfr hitchcock teresa wright joseph cotten macdonald carey henri traver
"https://m.media-amazon.com/images/M/MV5BOGQ4NDUyNWQtZTEyOC00OTMzLWFhYjAtNDNmYmQ2MWQyMTRmXkEyXkFqcGdeQXVyNTA4NzY1MzY@._V1_UX67_CR0,0,67,98_AL_.jpg",Stagecoach,"Adventure, Drama, Western",John Ford,adventur drama western group peopl travel stagecoach find journey complic threat geronimo learn someth process john ford john wayn clair trevor andi devin john carradin
"https://m.media-amazon.com/images/M/MV5BNjk3YzFjYTktOGY0ZS00Y2EwLTk2NTctYTI1Nzc2OWNiN2I4XkEyXkFqcGdeQXVyNzM0MTUwNTY@._V1_UX67_CR0,0,67,98_AL_.jpg",The Lady Vanishes,"Mystery, Thriller",Alfred Hitchcock,mysteri thriller travel continent europ rich young playgirl realiz elder ladi seem disappear train alfr hitchcock margaret lockwood michael redgrav paul luka may whitti
"https://m.media-amazon.com/images/M/MV5BMmVkOTRiYmItZjE4NS00MWNjLWE0ZmMtYzg5YzFjMjMyY2RkXkEyXkFqcGdeQXVyNjc1NTYyMjg@._V1_UX67_CR0,0,67,98_AL_.jpg",Bringing Up Baby,"Comedy, Family, Romance",Howard Hawks,comedi famili romanc tri secur million donat museum befuddl paleontologist pursu flighti often irrit heiress pet leopard babi howard hawk katharin hepburn cari grant charl ruggl walter catlett
"https://m.media-amazon.com/images/M/MV5BOTUzMzAzMzEzNV5BMl5BanBnXkFtZTgwOTg1NTAwMjE@._V1_UX67_CR0,0,67,98_AL_.jpg",Bride of Frankenstein,"Drama, Horror, Sci-Fi",James Whale,drama horror scifi mari shelley reveal main charact novel surviv dr frankenstein goad even madder scientist build monster mate jame whale bori karloff elsa lanchest colin clive valeri hobson
"https://m.media-amazon.com/images/M/MV5BYmYxZGU2NWYtNzQxZS00NmEyLWIzN2YtMDk5MWM0ODc5ZTE4XkEyXkFqcGdeQXVyNTA4NzY1MzY@._V1_UX67_CR0,0,67,98_AL_.jpg",Duck Soup,"Comedy, Musical, War",Leo McCarey,comedi music war rufus firefli name presidentdict bankrupt freedonia declar war neighbor sylvania love wealthi mrs teasdal leo mccarey groucho marx harpo marx chico marx zeppo marx
"https://m.media-amazon.com/images/M/MV5BYmMxZTU2ZDUtM2Y1MS00ZWFmLWJlN2UtNzI0OTJiOTYzMTk3XkEyXkFqcGdeQXVyMjUxODE0MDY@._V1_UX67_CR0,0,67,98_AL_.jpg",Scarface: The Shame of the Nation,"Action, Crime, Drama",Howard Hawks,action crime drama ambiti near insan violent gangster climb ladder success mob weak prove downfal howard hawk richard rosson paul muni ann dvorak karen morley
"https://m.media-amazon.com/images/M/MV5BMTQ0Njc1MjM0OF5BMl5BanBnXkFtZTgwNTY2NTUyMjE@._V1_UX67_CR0,0,67,98_AL_.jpg",Frankenstein,"Drama, Horror, Sci-Fi",James Whale,drama horror scifi dr frankenstein dare tamper life death creat human monster lifeless bodi part jame whale colin clive mae clark bori karloff john bole
"https://m.media-amazon.com/images/M/MV5BMTU0OTc3ODk4Ml5BMl5BanBnXkFtZTgwMzM4NzI5NjM@._V1_UX67_CR0,0,67,98_AL_.jpg",Roma,Drama,Alfonso Cuarón,drama year life middleclass famili maid mexico citi earli alfonso cuarón yalitza aparicio marina de tavira diego cortina autrey carlo peralta
"https://m.media-amazon.com/images/M/MV5BNjRhYzk2NDAtYzA1Mi00MmNmLWE1ZjQtMDBhZmUyMTdjZjBiXkEyXkFqcGdeQXVyNjk1Njg5NTA@._V1_UX67_CR0,0,67,98_AL_.jpg",God's Own Country,"Drama, Romance",Francis Lee,drama romanc spring yorkshir young farmer johnni saxbi numb daili frustrat bing drink casual sex arriv romanian migrant worker lamb season ignit intens relationship set johnni new path franci lee josh oconnor alec secareanu gemma jone ian hart
"https://m.media-amazon.com/images/M/MV5BNjk1Njk3YjctMmMyYS00Y2I4LThhMzktN2U0MTMyZTFlYWQ5XkEyXkFqcGdeQXVyODM2ODEzMDA@._V1_UY98_CR15,0,67,98_AL_.jpg",Deadpool 2,"Action, Adventure, Comedy",David Leitch,action adventur comedi foulmouth mutant mercenari wade wilson aka deadpool bring togeth team fellow mutant rogu protect young boy supernatur abil brutal timetravel cyborg cabl david leitch ryan reynold josh brolin morena baccarin julian dennison
"https://m.media-amazon.com/images/M/MV5BMTUyMjU1OTUwM15BMl5BanBnXkFtZTgwMDg1NDQ2MjI@._V1_UX67_CR0,0,67,98_AL_.jpg",Wind River,"Crime, Drama, Mystery",Taylor Sheridan,crime drama mysteri veteran hunter help fbi agent investig murder young woman wyom nativ american reserv taylor sheridan kelsey asbill jeremi renner julia jone teo brion
"https://m.media-amazon.com/images/M/MV5BMjUxMDQwNjcyNl5BMl5BanBnXkFtZTgwNzcwMzc0MTI@._V1_UX67_CR0,0,67,98_AL_.jpg",Get Out,"Horror, Mystery, Thriller",Jordan Peele,horror mysteri thriller young africanamerican visit white girlfriend parent weekend simmer uneasi recept eventu reach boil point jordan peel daniel kaluuya allison william bradley whitford catherin keener
"https://m.media-amazon.com/images/M/MV5BNjRlZmM0ODktY2RjNS00ZDdjLWJhZGYtNDljNWZkMGM5MTg0XkEyXkFqcGdeQXVyNjAwMjI5MDk@._V1_UX67_CR0,0,67,98_AL_.jpg",Mission: Impossible - Fallout,"Action, Adventure, Thriller",Christopher McQuarrie,action adventur thriller ethan hunt imf team along familiar alli race time mission gone wrong christoph mcquarri tom cruis henri cavil ving rhame simon pegg
"https://m.media-amazon.com/images/M/MV5BMjE0NDUyOTc2MV5BMl5BanBnXkFtZTgwODk2NzU3OTE@._V1_UX67_CR0,0,67,98_AL_.jpg",En man som heter Ove,"Comedy, Drama, Romance",Hannes Holm,comedi drama romanc ove illtemp isol retire spend day enforc block associ rule visit wife grave final given life unlik friendship develop boister new neighbor hann holm rolf lassgård bahar par filip berg ida engvol
"https://m.media-amazon.com/images/M/MV5BMjAwNDA5NzEwM15BMl5BanBnXkFtZTgwMTA1MDUyNDE@._V1_UX67_CR0,0,67,98_AL_.jpg",What We Do in the Shadows,"Comedy, Horror",Jemaine Clement,comedi horror viago deacon vladislav vampir find modern life struggl mundan like pay rent keep chore wheel tri get nightclub overcom flatmat conflict jemain clement taika waititi jemain clement taika waititi cori gonzalezmacu
"https://m.media-amazon.com/images/M/MV5BZTlmYTJmMWEtNDRhNy00ODc1LTg2OTMtMjk2ODJhNTA4YTE1XkEyXkFqcGdeQXVyMTMxODk2OTU@._V1_UY98_CR0,0,67,98_AL_.jpg",Omoide no Mânî,"Animation, Drama, Family",James Simone,anim drama famili due yo anna asthma sent stay relat guardian japanes countrysid like alon sketch befriend marni mysteri blond marni jame simon hiromasa yonebayashi sara takatsuki kasumi arimura nanako matsushima
"https://m.media-amazon.com/images/M/MV5BMTAwMTU4MDA3NDNeQTJeQWpwZ15BbWU4MDk4NTMxNTIx._V1_UX67_CR0,0,67,98_AL_.jpg",The Theory of Everything,"Biography, Drama, Romance",James Marsh,biographi drama romanc look relationship famous physicist stephen hawk wife jame marsh eddi redmayn felic jone tom prior sophi perri
"https://m.media-amazon.com/images/M/MV5BYTM3ZTllNzItNTNmOS00NzJiLTg1MWMtMjMxNDc0NmJhODU5XkEyXkFqcGdeQXVyODE5NzE3OTE@._V1_UX67_CR0,0,67,98_AL_.jpg",Kingsman: The Secret Service,"Action, Adventure, Comedy",Matthew Vaughn,action adventur comedi spi organis recruit promis street kid agenc train program global threat emerg twist tech genius matthew vaughn colin firth taron egerton samuel l jackson michael cain
"https://m.media-amazon.com/images/M/MV5BNTVkMTFiZWItOTFkOC00YTc3LWFhYzQtZTg3NzAxZjJlNTAyXkEyXkFqcGdeQXVyODE5NzE3OTE@._V1_UX67_CR0,0,67,98_AL_.jpg",The Fault in Our Stars,"Drama, Romance",Josh Boone,drama romanc two teenag cancer patient begin lifeaffirm journey visit reclus author amsterdam josh boon shailen woodley ansel elgort nat wolff laura dern
"https://m.media-amazon.com/images/M/MV5BNTA1NzUzNjY4MV5BMl5BanBnXkFtZTgwNDU0MDI0NTE@._V1_UX67_CR0,0,67,98_AL_.jpg",Me and Earl and the Dying Girl,"Comedy, Drama",Alfonso Gomez-Rejon,comedi drama high schooler greg spend time make parodi classic movi cowork earl find outlook forev alter befriend classmat diagnos cancer alfonso gomezrejon thoma mann rj cyler olivia cook nick offerman
"https://m.media-amazon.com/images/M/MV5BODAzNDMxMzAxOV5BMl5BanBnXkFtZTgwMDMxMjA4MjE@._V1_UX67_CR0,0,67,98_AL_.jpg",Birdman or (The Unexpected Virtue of Ignorance),"Comedy, Drama",Alejandro G. Iñárritu,comedi drama washedup superhero actor attempt reviv fade career write direct star broadway product alejandro g iñárritu michael keaton zach galifianaki edward norton andrea riseborough
"https://m.media-amazon.com/images/M/MV5BMTQ5NTg5ODk4OV5BMl5BanBnXkFtZTgwODc4MTMzMDE@._V1_UX67_CR0,0,67,98_AL_.jpg",La vie d'Adèle,"Drama, Romance",Abdellatif Kechiche,drama romanc adèl life chang meet emma young woman blue hair allow discov desir assert woman adult front other adèl grow seek lose ultim find love loss abdellatif kechich léa seydoux adèl exarchopoulo salim kechiouch aurélien reco
"https://m.media-amazon.com/images/M/MV5BMTgwNTAwMjEzMF5BMl5BanBnXkFtZTcwNzMzODY4OA@@._V1_UY98_CR3,0,67,98_AL_.jpg",Kai po che!,"Drama, Sport",Abhishek Kapoor,drama sport three friend grow india turn millennium set open train academi produc countri next cricket star abhishek kapoor amit sadh sushant singh rajput rajkummar rao amrita puri
"https://m.media-amazon.com/images/M/MV5BMTQzMzg2Nzg2MF5BMl5BanBnXkFtZTgwNjUzNzIzMDE@._V1_UX67_CR0,0,67,98_AL_.jpg",The Broken Circle Breakdown,"Drama, Music, Romance",Felix van Groeningen,drama music romanc elis didier fall love first sight spite differ talk listen romant atheist religi realist daughter becom serious ill love put trial felix van groeningen veerl baeten johan heldenbergh nell cattryss geert van rampelberg
"https://m.media-amazon.com/images/M/MV5BMzA2NDkwODAwM15BMl5BanBnXkFtZTgwODk5MTgzMTE@._V1_UY98_CR0,0,67,98_AL_.jpg",Captain America: The Winter Soldier,"Action, Adventure, Sci-Fi",Anthony Russo,action adventur scifi steve roger struggl embrac role modern world team fellow aveng shield agent black widow battl new threat histori assassin known winter soldier anthoni russo joe russo chris evan samuel l jackson scarlett johansson
"https://m.media-amazon.com/images/M/MV5BOTc3NzAxMjg4M15BMl5BanBnXkFtZTcwMDc2ODQwNw@@._V1_UY98_CR3,0,67,98_AL_.jpg",Rockstar,"Drama, Music, Musical",Imtiaz Ali,drama music music janardhan jakhar chase dream becom big rock star fall love heer imtiaz ali ranbir kapoor nargi fakhri shammi kapoor kumud mishra
"https://m.media-amazon.com/images/M/MV5BOGQzODdlMDktNzU4ZC00N2M3LWFkYTAtYTM1NTE0ZWI5YTg4XkEyXkFqcGdeQXVyMTA1NTM1NDI2._V1_UX67_CR0,0,67,98_AL_.jpg",Nebraska,"Adventure, Comedy, Drama",Alexander Payne,adventur comedi drama age boozeaddl father make trip montana nebraska estrang son order claim milliondollar mega sweepstak market prize alexand payn bruce dern fort june squibb bob odenkirk
"https://m.media-amazon.com/images/M/MV5BNzMxNTExOTkyMF5BMl5BanBnXkFtZTcwMzEyNDc0OA@@._V1_UX67_CR0,0,67,98_AL_.jpg",Wreck-It Ralph,"Animation, Adventure, Comedy",Rich Moore,anim adventur comedi video game villain want hero set fulfil dream quest bring havoc whole arcad live rich moor john c reilli jack mcbrayer jane lynch sarah silverman
"https://m.media-amazon.com/images/M/MV5BNjg0OTM5OTQyNV5BMl5BanBnXkFtZTgwNDg5NDQ0NTE@._V1_UY98_CR2,0,67,98_AL_.jpg",Le Petit Prince,"Animation, Adventure, Drama",Mark Osborne,anim adventur drama littl girl live grownup world mother tri prepar neighbor aviat introduc girl extraordinari world anyth possibl world littl princ mark osborn jeff bridg mackenzi foy rachel mcadam marion cotillard
"https://m.media-amazon.com/images/M/MV5BMTM3NzQzMDA5Ml5BMl5BanBnXkFtZTcwODA5NTcyNw@@._V1_UY98_CR0,0,67,98_AL_.jpg",Detachment,Drama,Tony Kaye,drama substitut teacher drift classroom classroom find connect student teacher latest assign toni kay adrien brodi christina hendrick marcia gay harden luci liu
"https://m.media-amazon.com/images/M/MV5BMTM4NjY1MDQwMl5BMl5BanBnXkFtZTcwNTI3Njg3NA@@._V1_UX67_CR0,0,67,98_AL_.jpg",Midnight in Paris,"Comedy, Fantasy, Romance",Woody Allen,comedi fantasi romanc trip pari fiancé famili nostalg screenwrit find mysteri go back everi day midnight woodi allen owen wilson rachel mcadam kathi bate kurt fuller
"https://m.media-amazon.com/images/M/MV5BMTg4MDk1ODExN15BMl5BanBnXkFtZTgwNzIyNjg3MDE@._V1_UX67_CR0,0,67,98_AL_.jpg",The Lego Movie,"Animation, Action, Adventure",Christopher Miller,anim action adventur ordinari lego construct worker thought prophesi special recruit join quest stop evil tyrant glu lego univers etern stasi christoph miller phil lord chris pratt ferrel elizabeth bank
"https://m.media-amazon.com/images/M/MV5BNjE5MzYwMzYxMF5BMl5BanBnXkFtZTcwOTk4MTk0OQ@@._V1_UX67_CR0,0,67,98_AL_.jpg",Gravity,"Drama, Sci-Fi, Thriller",Alfonso Cuarón,drama scifi thriller two astronaut work togeth surviv accid leav strand space alfonso cuarón sandra bullock georg clooney ed harri orto ignatiussen
"https://m.media-amazon.com/images/M/MV5BMTk2NzczOTgxNF5BMl5BanBnXkFtZTcwODQ5ODczOQ@@._V1_UX67_CR0,0,67,98_AL_.jpg",Star Trek Into Darkness,"Action, Adventure, Sci-Fi",J.J. Abrams,action adventur scifi crew enterpris find unstopp forc terror within organ captain kirk lead manhunt warzon world captur oneman weapon mass destruct jj abram chris pine zachari quinto zoe saldana benedict cumberbatch
"https://m.media-amazon.com/images/M/MV5BMTYwMzMzMDI0NF5BMl5BanBnXkFtZTgwNDQ3NjI3NjE@._V1_UX67_CR0,0,67,98_AL_.jpg",Beasts of No Nation,"Drama, War",Cary Joji Fukunaga,drama war drama base experi agu child soldier fight civil war unnam african countri cari joji fukunaga abraham attah emmanuel affadzi ricki adelayitor andrew adot
"https://m.media-amazon.com/images/M/MV5BOGUyZDUxZjEtMmIzMC00MzlmLTg4MGItZWJmMzBhZjE0Mjc1XkEyXkFqcGdeQXVyMTMxODk2OTU@._V1_UX67_CR0,0,67,98_AL_.jpg",The Social Network,"Biography, Drama",David Fincher,biographi drama harvard student mark zuckerberg creat social network site would becom known facebook su twin claim stole idea cofound later squeez busi david fincher jess eisenberg andrew garfield justin timberlak rooney mara
"https://m.media-amazon.com/images/M/MV5BMTg5OTMxNzk4Nl5BMl5BanBnXkFtZTcwOTk1MjAwNQ@@._V1_UX67_CR0,0,67,98_AL_.jpg",X: First Class,"Action, Adventure, Sci-Fi",Matthew Vaughn,action adventur scifi superpow human charl xavier erik lensherr work togeth find other like erik veng pursuit ambiti mutant ruin life caus schism divid matthew vaughn jame mcavoy michael fassbend jennif lawrenc kevin bacon
"https://m.media-amazon.com/images/M/MV5BNGQwZjg5YmYtY2VkNC00NzliLTljYTctNzI5NmU3MjE2ODQzXkEyXkFqcGdeQXVyNzkwMjQ5NzM@._V1_UX67_CR0,0,67,98_AL_.jpg",The Hangover,Comedy,Todd Phillips,comedi three buddi wake bachelor parti las vega memori previous night bachelor miss make way around citi order find friend wed todd phillip zach galifianaki bradley cooper justin bartha ed helm
"https://m.media-amazon.com/images/M/MV5BMWZiNjE2OWItMTkwNy00ZWQzLWI0NTgtMWE0NjNiYTljN2Q1XkEyXkFqcGdeQXVyNzAwMjYxMzA@._V1_UX67_CR0,0,67,98_AL_.jpg",Skyfall,"Action, Adventure, Thriller",Sam Mendes,action adventur thriller jame bond loyalti test past come back haunt mi come attack must track destroy threat matter person cost sam mend daniel craig javier bardem naomi harri judi dench
"https://m.media-amazon.com/images/M/MV5BMTM2MTI5NzA3MF5BMl5BanBnXkFtZTcwODExNTc0OA@@._V1_UX67_CR0,0,67,98_AL_.jpg",Silver Linings Playbook,"Comedy, Drama, Romance",David O. Russell,comedi drama romanc stint mental institut former teacher pat solitano move back parent tri reconcil exwif thing get challeng pat meet tiffani mysteri girl problem david russel bradley cooper jennif lawrenc robert de niro jacki weaver
"https://m.media-amazon.com/images/M/MV5BNzljNjY3MDYtYzc0Ni00YjU0LWIyNDUtNTE0ZDRiMGExMjZlXkEyXkFqcGdeQXVyMTMxODk2OTU@._V1_UX67_CR0,0,67,98_AL_.jpg",Argo,"Biography, Drama, Thriller",Ben Affleck,biographi drama thriller act cover hollywood produc scout locat scienc fiction film cia agent launch danger oper rescu six american tehran us hostag crisi iran ben affleck ben affleck bryan cranston john goodman alan arkin
"https://m.media-amazon.com/images/M/MV5BMTk5MjM4OTU1OV5BMl5BanBnXkFtZTcwODkzNDIzMw@@._V1_UX67_CR0,0,67,98_AL_.jpg",(500) Days of Summer,"Comedy, Drama, Romance",Marc Webb,comedi drama romanc offbeat romant comedi woman not believ true love exist young man fall marc webb zooey deschanel joseph gordonlevitt geoffrey arend chloë grace moretz
"https://m.media-amazon.com/images/M/MV5BMTQ2OTE1Mjk0N15BMl5BanBnXkFtZTcwODE3MDAwNA@@._V1_UX67_CR0,0,67,98_AL_.jpg",Harry Potter and the Deathly Hallows: Part 1,"Adventure, Family, Fantasy",David Yates,adventur famili fantasi harri ron hermion race time evil destroy horcrux uncov exist three power object wizard world death hallow david yate daniel radcliff emma watson rupert grint bill nighi
"https://m.media-amazon.com/images/M/MV5BOTc3YmM3N2QtODZkMC00ZDE5LThjMTQtYTljN2Y1YTYwYWJkXkEyXkFqcGdeQXVyODEzNjM5OTQ@._V1_UX67_CR0,0,67,98_AL_.jpg",Gake no ue no Ponyo,"Animation, Adventure, Comedy",Hayao Miyazaki,anim adventur comedi fiveyearold boy develop relationship ponyo young goldfish princess long becom human fall love hayao miyazaki cate blanchett matt damon liam neeson tomoko yamaguchi
"https://m.media-amazon.com/images/M/MV5BOTY4NTU2NTU4NF5BMl5BanBnXkFtZTcwNjE0OTc5MQ@@._V1_UX67_CR0,0,67,98_AL_.jpg",Frost/Nixon,"Biography, Drama, History",Ron Howard,biographi drama histori dramat retel postwaterg televis interview british talkshow host david frost former presid richard nixon ron howard frank langella michael sheen kevin bacon sam rockwel
"https://m.media-amazon.com/images/M/MV5BNDliMTMxOWEtODM3Yi00N2QwLTg4YTAtNTE5YzBlNTA2NjhlXkEyXkFqcGdeQXVyNjE5MjUyOTM@._V1_UX67_CR0,0,67,98_AL_.jpg",Papurika,"Animation, Drama, Fantasy",Satoshi Kon,anim drama fantasi machin allow therapist enter patient dream stolen hell break loos young femal therapist paprika stop satoshi kon megumi hayashibara tôru emori katsunosuk hori tôru furuya
"https://m.media-amazon.com/images/M/MV5BOTA1Mzg3NjIxNV5BMl5BanBnXkFtZTcwNzU2NTc5MQ@@._V1_UX67_CR0,0,67,98_AL_.jpg",Changeling,"Biography, Crime, Drama",Clint Eastwood,biographi crime drama griefstricken mother christin collin angelina joli take lapd detriment tri pass obvious impostor miss child clint eastwood angelina joli colm feor ami ryan gattlin griffith
